{
  "config_version": "chatglm2-ptuning-task-v1",
  "task": "business",
  "model_contract": "configs/models/chatglm2_6b_ptuning_v2.json",
  "messages_root": "artifacts/datasets/messages/v1/examples/business",
  "output_dir": "artifacts/checkpoints/chatglm2-6b/business-prefix-v1",
  "max_source_length": 1024,
  "max_target_length": 64,
  "length_status": "provisional_until_token_audit",
  "validation": {
    "source": "deterministic_hash_partition_from_train",
    "fraction": 0.05,
    "seed": 42,
    "test_split_usage": "final_evaluation_only"
  },
  "optimization": {
    "learning_rate": 0.02,
    "per_device_train_batch_size": 1,
    "gradient_accumulation_steps": 16,
    "max_steps": 20000,
    "save_steps": 4000,
    "seed": 42
  }
}
